{
  "version": 1,
  "passScore": 30,
  "maxIterationsPerPage": 5,
  "plateauLimit": 2,
  "currentPageIndex": 0,
  "updatedAt": "1970-01-01T00:00:00Z",
  "activePack": null,
  "loopArmed": false,
  "pages": [
    {
      "id": "shell",
      "target": "UI/Client.WinUI/MainWindow.xaml",
      "captureLabel": "shell",
      "status": "pending",
      "iterations": 0,
      "scoreBefore": null,
      "scoreAfter": null,
      "bestScore": null,
      "lastSlug": null,
      "lastPack": null,
      "lastCritiqueFile": null,
      "stuckReason": null,
      "scores": []
    },
    {
      "id": "home",
      "target": "UI/Client.WinUI/Pages/HomePage.xaml",
      "captureLabel": "home",
      "status": "pending",
      "iterations": 0,
      "scoreBefore": null,
      "scoreAfter": null,
      "bestScore": null,
      "lastSlug": null,
      "lastPack": null,
      "lastCritiqueFile": null,
      "stuckReason": null,
      "scores": []
    },
    {
      "id": "browse",
      "target": "UI/Client.WinUI/Pages/BrowsePage.xaml",
      "captureLabel": "browse",
      "status": "pending",
      "iterations": 0,
      "scoreBefore": null,
      "scoreAfter": null,
      "bestScore": null,
      "lastSlug": null,
      "lastPack": null,
      "lastCritiqueFile": null,
      "stuckReason": null,
      "scores": []
    },
    {
      "id": "chat",
      "target": "UI/Client.WinUI/Pages/ChatPage.xaml",
      "captureLabel": "chat",
      "status": "pending",
      "iterations": 0,
      "scoreBefore": null,
      "scoreAfter": null,
      "bestScore": null,
      "lastSlug": null,
      "lastPack": null,
      "lastCritiqueFile": null,
      "stuckReason": null,
      "scores": []
    },
    {
      "id": "search",
      "target": "UI/Client.WinUI/Views/FeatureViews.cs#SearchView",
      "captureLabel": "search",
      "status": "pending",
      "iterations": 0,
      "scoreBefore": null,
      "scoreAfter": null,
      "bestScore": null,
      "lastSlug": null,
      "lastPack": null,
      "lastCritiqueFile": null,
      "stuckReason": null,
      "scores": []
    },
    {
      "id": "queue",
      "target": "UI/Client.WinUI/Views/FeatureViews.cs#DownloadQueueView",
      "captureLabel": "queue",
      "status": "pending",
      "iterations": 0,
      "scoreBefore": null,
      "scoreAfter": null,
      "bestScore": null,
      "lastSlug": null,
      "lastPack": null,
      "lastCritiqueFile": null,
      "stuckReason": null,
      "scores": []
    },
    {
      "id": "shares",
      "target": "UI/Client.WinUI/Views/FeatureViews.cs#SharesView",
      "captureLabel": "shares",
      "status": "pending",
      "iterations": 0,
      "scoreBefore": null,
      "scoreAfter": null,
      "bestScore": null,
      "lastSlug": null,
      "lastPack": null,
      "lastCritiqueFile": null,
      "stuckReason": null,
      "scores": []
    },
    {
      "id": "compare",
      "target": "UI/Client.WinUI/Views/FeatureViews.cs#CompareView",
      "captureLabel": "compare",
      "status": "pending",
      "iterations": 0,
      "scoreBefore": null,
      "scoreAfter": null,
      "bestScore": null,
      "lastSlug": null,
      "lastPack": null,
      "lastCritiqueFile": null,
      "stuckReason": null,
      "scores": []
    },
    {
      "id": "settings",
      "target": "UI/Client.WinUI/Views/FeatureViews.cs#SettingsView",
      "captureLabel": "settings",
      "status": "pending",
      "iterations": 0,
      "scoreBefore": null,
      "scoreAfter": null,
      "bestScore": null,
      "lastSlug": null,
      "lastPack": null,
      "lastCritiqueFile": null,
      "stuckReason": null,
      "scores": []
    }
  ]
}
